{
  "$schema": "http://json-schema.org/draft-07/schema#",
  "title": "DesignTokensSchema",
  "description": "Schema definition for design-tokens.json enforced by web-theme-curator",
  "type": "object",
  "required": ["name", "palette", "typography"],
  "properties": {
    "name": {
      "type": "string",
      "pattern": "^[a-z0-9-]+$"
    },
    "remBase": {
      "type": "number",
      "default": 16,
      "description": "Base px per rem (default 16)"
    },
    "palette": {
      "type": "object",
      "required": ["primary", "bgBase", "textMain", "textSecondary"],
      "properties": {
        "primary": { "type": "string" },
        "primaryHover": { "type": "string" },
        "bgBase": { "type": "string" },
        "bgCard": { "type": "string" },
        "textMain": { "type": "string" },
        "textSecondary": { "type": "string" },
        "border": { "type": "string" },
        "chartPalette": {
          "type": "array",
          "items": { "type": "string" }
        }
      }
    },
    "typography": {
      "type": "object",
      "required": ["fontFamilyBase", "scale"],
      "properties": {
        "fontFamilyBase": { "type": "string" },
        "scale": {
          "type": "object",
          "required": ["floor", "base"],
          "properties": {
            "floor": { "type": "string", "pattern": "^(1[2-9]|[2-9][0-9])px$" },
            "sm": { "type": "string", "pattern": "^(1[2-9]|[2-9][0-9])px$" },
            "base": { "type": "string", "pattern": "^(1[2-9]|[2-9][0-9])px$" },
            "lg": { "type": "string", "pattern": "^(1[2-9]|[2-9][0-9])px$" },
            "xl": { "type": "string", "pattern": "^(1[2-9]|[2-9][0-9])px$" },
            "2xl": { "type": "string", "pattern": "^(1[2-9]|[2-9][0-9])px$" }
          }
        },
        "leading": {
          "type": "object",
          "properties": {
            "tight": { "type": "number" },
            "normal": { "type": "number" },
            "relaxed": { "type": "number" }
          }
        }
      }
    }
  }
}
